[
  {
    "schema_version": "1.0.0",
    "query_id": "q:abstain:001",
    "raw_text": "Is this root rot? Can I repot normally, or would I have to completely cut off the bottom bit?",
    "platform": "reddit",
    "url": "https://www.reddit.com/r/plantclinic/comments/1e3h0bq/",
    "source_location": "post_body",
    "language": "en",
    "plant_id": null,
    "expected_dimensions": ["symptom", "disease"],
    "reason": "out_of_scope_plant",
    "notes": "帖子对象为当前 KB 之外的多肉植物。"
  },
  {
    "schema_version": "1.0.0",
    "query_id": "q:abstain:002",
    "raw_text": "Need advice with rotting jade plant",
    "platform": "reddit",
    "url": "https://www.reddit.com/r/plantclinic/comments/1uq5edk/",
    "source_location": "post_title",
    "language": "en",
    "plant_id": null,
    "expected_dimensions": ["symptom", "disease"],
    "reason": "out_of_scope_plant"
  },
  {
    "schema_version": "1.0.0",
    "query_id": "q:abstain:003",
    "raw_text": "Rescue Prayer plant",
    "platform": "reddit",
    "url": "https://www.reddit.com/r/plantclinic/comments/1lhh3on/",
    "source_location": "post_title",
    "language": "en",
    "plant_id": null,
    "expected_dimensions": ["symptom"],
    "reason": "out_of_scope_plant"
  },
  {
    "schema_version": "1.0.0",
    "query_id": "q:abstain:004",
    "raw_text": "What is wrong with my peacelilies?",
    "platform": "reddit",
    "url": "https://www.reddit.com/r/plantclinic/comments/1uec9j9/",
    "source_location": "post_title",
    "language": "en",
    "plant_id": null,
    "expected_dimensions": ["symptom"],
    "reason": "out_of_scope_plant"
  },
  {
    "schema_version": "1.0.0",
    "query_id": "q:abstain:005",
    "raw_text": "When to repot newer monstera?",
    "platform": "reddit",
    "url": "https://www.reddit.com/r/houseplants/comments/1twpd00/",
    "source_location": "post_title",
    "language": "en",
    "plant_id": "plant:monstera_deliciosa",
    "expected_dimensions": ["repotting"],
    "reason": "missing_dimension"
  },
  {
    "schema_version": "1.0.0",
    "query_id": "q:abstain:006",
    "raw_text": "Fertilizer question",
    "platform": "reddit",
    "url": "https://www.reddit.com/r/pothos/comments/1k7r31p/",
    "source_location": "post_title",
    "language": "en",
    "plant_id": "plant:epipremnum_aureum",
    "expected_dimensions": ["fertilizer"],
    "reason": "missing_dimension"
  },
  {
    "schema_version": "1.0.0",
    "query_id": "q:abstain:007",
    "raw_text": "HELP! My snake plant propagation isn't rooting.",
    "platform": "reddit",
    "url": "https://www.reddit.com/r/propagation/comments/1todpfp/",
    "source_location": "post_body",
    "language": "en",
    "plant_id": "plant:dracaena_trifasciata",
    "expected_dimensions": ["propagation"],
    "reason": "missing_dimension"
  },
  {
    "schema_version": "1.0.0",
    "query_id": "q:abstain:008",
    "raw_text": "Plant food / fertilizer to use for repotting snake plant and pothos?",
    "platform": "reddit",
    "url": "https://www.reddit.com/r/houseplants/comments/132wjco/",
    "source_location": "post_title",
    "language": "en",
    "plant_id": null,
    "expected_dimensions": ["fertilizer", "repotting"],
    "reason": "missing_dimension"
  },
  {
    "schema_version": "1.0.0",
    "query_id": "q:abstain:009",
    "raw_text": "I also tried staking it and I’m not sure if I did it right.",
    "platform": "reddit",
    "url": "https://www.reddit.com/r/houseplants/comments/1rwhais/",
    "source_location": "post_body",
    "language": "en",
    "plant_id": "plant:monstera_deliciosa",
    "expected_dimensions": ["plant_support"],
    "reason": "missing_dimension"
  },
  {
    "schema_version": "1.0.0",
    "query_id": "q:abstain:010",
    "raw_text": "Could anyone tell me what it is and how to treat it?",
    "platform": "reddit",
    "url": "https://www.reddit.com/r/plantclinic/comments/1fcrjjt/",
    "source_location": "post_body",
    "language": "en",
    "plant_id": "plant:monstera_deliciosa",
    "expected_dimensions": ["symptom", "disease"],
    "reason": "image_required",
    "notes": "问题指向图片中的褐斑；文本本身没有足够诊断信息。"
  }
]
